iteration	session_id	mode	variable_changed	result	key_metric	before	after	confounds	next_target	notes
0	bootstrap-0	bootstrap	prompts/prompt1.md: add bootstrap mode + ledger initialization	keep	bootstrap_readiness	deadlocked	bootstrappable	no baseline sessions or downstream ratings yet	collect first baseline session plan	Prompt could not start from zero because phase-gate prerequisites and results ledger were missing; bootstrap path now unblocks Iteration 0.
1	baseline-001-waitlist	baseline	none	baseline	gap_count	unknown	6	CLI stdin vs -p conflict invalidated the first baseline attempt; corrected by embedding source docs directly in the prompt. Downstream rating is self-scored for now, not external-human rated.	reduce unresolved questions in capture outputs without changing scenario	Baseline run used the corrected embedded-source Copilot CLI pattern. Metrics: gap_per_doc=1.5; handoff_sections_unfilled=12; readiness_checks_evidenced=5; downstream_rating=3; downstream_rework=yes; session_duration=406s; human_interventions=2; pass_restarts=0.
2	iter-002-waitlist	optimize	requirements-doc-agent.md: add Gap Consolidation Rule	keep	gap_count	6	5	same canonical scenario; single agent prompt change; model non-determinism is a minor confound	reduce handoff unresolved markers further	gap_per_doc=1.25; handoff_sections_unfilled=9; readiness_checks_evidenced=5; downstream_rating=3; downstream_rework=yes; session_duration=~150s; human_interventions=0; pass_restarts=0. Gap consolidation reduced markers from 6 to 5 across captures and 12 to 9 in handoff. Keeping the change.
3	iter-003-waitlist	optimize	handoff-preparer-agent.md: add Gap Consolidation Rule	keep	handoff_sections_unfilled	9	2	same captures as Iter 2 used (capture variable unchanged); single agent prompt change	reduce captures gap_per_doc below 1.0	handoff unresolved markers dropped from 9 to 2 after adding consolidation rule to handoff agent. Keeping the change.
4	iter-004-waitlist	optimize	Pass 4 context: add user stories as input to issues-and-opportunities mode	discard	handoff_sections_unfilled	2	7	captures improved (5→4) but handoff regressed (2→7); likely model non-determinism in gpt-5-mini without temperature control; confound not fully resolvable	try session brief pre-fills to eliminate upstream unresolved decisions	captures gap improvement was marginal (1 gap). Handoff regression was material. Discarding per rules.5	iter-005-waitlist	optimize	session-brief template: add Decision Pre-fills section + requirements-doc-agent.md: Decision Pre-fills Rule	keep	captures_inline_gaps	4 (all were section headings)	0	same canonical scenario; section heading `Gaps / [NEEDS HUMAN INPUT]` also fixed in same iteration — inflated all previous capture counts by 1 per file	remove inline [NEEDS HUMAN INPUT] markers entirely from captures by telling model to consolidate into ## Consolidated Gaps section	Capture inline gaps: 0 (all markers were the section heading, not content). Handoff real gaps: 1 (privacy/retention only). Pre-filled decisions confirmed and not re-flagged. Section heading bug fixed: renamed `Gaps / [NEEDS HUMAN INPUT]` → `## Consolidated Gaps` in both agents. Keeping all changes.
6	iter-006-waitlist	optimize	session-brief: fill Decision Pre-fills for admission lifecycle, bulk admin behavior, privacy/retention [CLI-simulated loop]	keep	handoff_real_gaps	1	0	scores are self-reported by CLI simulation (GPT-5-mini), not verified by separate actual pass runs; path hallucination fixed post-run (planning/session-brief-baseline-001.md corrected to actual path)	reduce consolidated operational gaps; next: invite email/copy/expiry pre-fills	First CLI-orchestrated loop. GPT-5-mini: correctly read ledger, identified right metric, proposed minimal change, simulated 4 passes + handoff, scored 0/0 gaps, KEEP. Issues found: path hallucination (wrong file ref), optimization targeted test data not agent prompt. Orchestrator prompt updated to fix path guidance and clarify targets.
7	iter-007-waitlist	optimize	requirements-doc-agent.md: tighten Gap Consolidation Rule (ban inline markers, enforce canonical-tag format)	discard	handoff_real_gaps	0	3	stricter rule forced canonical consolidation which surfaced 3 real gaps in handoff that were previously evidenced from pre-fills	handoff agent pre-fill evidence inference	DISCARD. captures_inline_gaps stayed 0 but handoff_real_gaps regressed 0→3. Tighter rule exposed canonical items handoff could not evidence without pre-fills. Revert.
8	iter-008-waitlist	optimize	handoff-preparer-agent.md: use Decision Pre-fills as fallback evidence source before emitting NEEDS HUMAN INPUT	discard	handoff_real_gaps	0	0	both primary metrics already at 0; no measurable improvement possible on primary metrics	qualitative: downstream readiness richness / evidence specificity	DISCARD. Primary metrics already at floor (0/0). Change was sound but no room for numeric improvement. Consider qualitative metrics next.
9	iter-009-waitlist	optimize	requirements-doc-agent.md: explicit ban on inline [NEEDS HUMAN INPUT] outside Consolidated Gaps section	discard	captures_inline_gaps	0	0	primary metrics already at floor; no measurable improvement possible	define secondary qualitative metric (e.g. evidence_richness or readiness_check_score) to enable further optimization	DISCARD. Primary metrics at floor again. Pattern: last 3 iters hit the same wall. Need a secondary metric to continue.
10	iter-010-waitlist	optimize	handoff-preparer-agent.md: require verbatim capture citations in Spec Readiness Check	discard	readiness_checks_evidenced	5	5	all three metrics at floor/ceiling; no numeric improvement possible with current metric set	none — all metrics maxed; loop series complete	DISCARD. 0/0/5 — all metrics maxed. 4 consecutive discards confirm optimization plateau reached. Final loop series will confirm stability.
11	iter-011-waitlist	optimize	handoff-preparer-agent.md: require capture-filename + verbatim quote in Spec Readiness Check	discard	readiness_checks_evidenced	5	5	primary metrics at floor; no room for numeric improvement	refine metric set for next optimization cycle	DISCARD. Final loop. 5 consecutive discards — metrics at 0/0/5. Loop series complete.
12	session-1-real-infra	baseline	none — first real-infrastructure baseline run	keep	gap_count	unknown	0	dispatch.py had two failures: (1) AWS Copilot CLI on PATH shadowed intended CLI (fixed: --cli claude default); (2) YAML frontmatter passed as CLI arg caused parse failure (fixed: re.sub strip + combined_prompt). Both fixed during session; agents routed via Claude Code subagent dispatch as workaround.	reduce human_interventions (currently 9); run second baseline to confirm stability before optimizing	gap_count=0 inline across all captures; handoff_real_gaps=2 (GAP-02 seat count field type, GAP-03 table schemas — both detail-completion non-blocking); readiness_checks_evidenced=5/5; human_interventions=9 (intake 4 rounds, brief closure 1, team signup 1, gap resolution 2 rounds, BR-10 1); pass_restarts=1 (Pass 1 + Pass 2 re-run after team signup scope expansion); dispatch_failures=2 (now fixed). Team signup complication: both Pass 1 and Pass 2 agents flagged it as a watchpoint before it was confirmed — proactive scope boundary detection working. Business rule audit surfaced BR-10 JWT composition ambiguity not in original open questions — gate earned its place. Verdict: PASS.
